{
  "source_commit": "53f18d8b5689a25bc03b647b54eb1a4ba0cd78ef",
  "source_snapshot": "f808f084937fa036ca89560a321819ec0c09e4d0acbcba032e3fdfe2cc03f5b5",
  "run_id": "frozen-source-run",
  "contract_version": "m4-contract-1.0",
  "artifact_subject": null,
  "execution_subject": {
    "kind": "source",
    "source_commit": "53f18d8b5689a25bc03b647b54eb1a4ba0cd78ef",
    "source_snapshot": "f808f084937fa036ca89560a321819ec0c09e4d0acbcba032e3fdfe2cc03f5b5"
  },
  "schema_version": "1.0",
  "control_id": "UNIT_TEST",
  "execution_status": "SUCCESS",
  "raw_exit_code": 0,
  "policy_verdict": "PASS",
  "reason": "Actual pytest/JUnit execution",
  "tool": {
    "name": "pytest",
    "version": "9.1.1"
  },
  "report": {
    "path": "unit-report.json",
    "sha256": "98bb9e757d2bbad6df5a761c54ccbc3bb7449ffcadb8039f2c3c26f5235baf3a"
  },
  "execution_path": "unit-test-execution.json",
  "wrapper_exit_code": null,
  "policy_exit_code": null
}
