{
  "source_commit": "53f18d8b5689a25bc03b647b54eb1a4ba0cd78ef",
  "source_snapshot": "f808f084937fa036ca89560a321819ec0c09e4d0acbcba032e3fdfe2cc03f5b5",
  "run_id": "frozen-source-run",
  "contract_version": "m4-contract-1.0",
  "artifact_subject": null,
  "execution_subject": {
    "kind": "source",
    "source_commit": "53f18d8b5689a25bc03b647b54eb1a4ba0cd78ef",
    "source_snapshot": "f808f084937fa036ca89560a321819ec0c09e4d0acbcba032e3fdfe2cc03f5b5"
  },
  "schema_version": "1.0",
  "control_id": "DEPENDENCY",
  "execution_status": "SUCCESS",
  "raw_exit_code": 0,
  "policy_verdict": "PASS",
  "reason": "Active source manifest satisfies allowlist",
  "tool": {
    "name": "dependency-policy",
    "version": "1.0"
  },
  "report": {
    "path": "dependency-report.json",
    "sha256": "e4578942fa6165fc5bdbe1e82ef9af190b7955c8af89eaa73e37fbe60f30e018"
  },
  "execution_path": "dependency-execution.json",
  "wrapper_exit_code": null,
  "policy_exit_code": null
}
