{
  "source_commit": "53f18d8b5689a25bc03b647b54eb1a4ba0cd78ef",
  "source_snapshot": "f808f084937fa036ca89560a321819ec0c09e4d0acbcba032e3fdfe2cc03f5b5",
  "run_id": "frozen-source-run",
  "contract_version": "m4-contract-1.0",
  "artifact_subject": null,
  "execution_subject": {
    "kind": "source",
    "source_commit": "53f18d8b5689a25bc03b647b54eb1a4ba0cd78ef",
    "source_snapshot": "f808f084937fa036ca89560a321819ec0c09e4d0acbcba032e3fdfe2cc03f5b5"
  },
  "schema_version": "1.0",
  "control_id": "GITLEAKS",
  "execution_status": "ERROR",
  "raw_exit_code": null,
  "policy_verdict": "ERROR",
  "reason": "Binary integrity/version/platform verification failed",
  "tool": {
    "name": "Gitleaks",
    "version": "UNAVAILABLE"
  },
  "report": null,
  "execution_path": "gitleaks-execution.json",
  "wrapper_exit_code": null,
  "policy_exit_code": null
}
